{
  "abbreviation": "example_abbreviation",
  "active": true,
  "address": "example_address",
  "amenities": [],
  "areaUnits": "Sq Ft",
  "buildingID": 1,
  "category": "RESIDENTIAL",
  "county": "example_county",
  "createdBy": "example_createdBy",
  "createdDateTime": "2024-01-01T00:00:00Z",
  "customFields": [],
  "floorNumber": 1,
  "id": 1,
  "idNumber": 1,
  "lastModifiedBy": "example_lastModifiedBy",
  "lastModifiedDateTime": "2024-01-01T00:00:00Z",
  "leaseID": 1,
  "maintenanceNotice": "example_maintenanceNotice",
  "maintenanceSpendingLimitTime": "NO_LIMIT",
  "management": "example_management",
  "marketing": "example_marketing",
  "name": "example_name",
  "neighborhood": "example_neighborhood",
  "numberFloors": 1,
  "numberOfBathrooms": 1.0,
  "numberOfBedrooms": 1,
  "portfolioID": 1,
  "propertyManagerList": [],
  "ready": true,
  "rentable": true,
  "searchTag": "example_searchTag",
  "status": "example_status",
  "syndicate": true,
  "targetDeposit": "example_targetDeposit",
  "targetRent": 1.0,
  "targetRentUnits": "DOLLAR_PER_SQ_FT_MONTH",
  "totalArea": 1.0,
  "type": "example_type",
  "website": "example_website",
  "yearBuilt": 1
}